{
  "schema_version": "2.0.0",
  "event_id": "example-release-1",
  "recorded_at": "2024-01-10T15:00:00Z",
  "git_dirty": false,
  "git_repository": "https://github.com/statisticsnorway/example-production",
  "dapla_team": "tip-tutorials",
  "statistics_name": "metstat",
  "git_tag": "2025.12",
  "git_commit_hash": "5faec80b4746112ef9df340cbaf779bff0a00a7f",
  "data_source": [
    {
      "path": "gs://ssb-tip-tutorials-data-produkt-prod/metstat/utdata/observations_p2025-12-01_p2025-12-31_v1.parquet",
      "generation": "1760000000000003"
    },
    {
      "path": "gs://ssb-tip-tutorials-data-produkt-prod/metstat/utdata/weather_stations_p2025-01-01_v1.parquet",
      "generation": "1760000000000004"
    }
  ],
  "daplalab_image": "ghcr.io/statisticsnorway/daplalab-jupyter:0.18.10"
}